Phylum,学名,图片,标签,简介,详细介绍
mesozoa,中生动物门,https://timgsa.baidu.com/timg?image&quality=80&size=b9999_10000&sec=1492626390133&di=4b7c06afee460984292583a1280e5c11&imgtype=0&src=http%3A%2F%2Fa.hiphotos.baidu.com%2Fbaike%2Fc0%253Dbaike60%252C5%252C5%252C60%252C20%2Fsign%3D06efd34cb9014a9095334eefc81e5277%2F5882b2b7d0a20cf42955922176094b36adaf9902.jpg,自然 生物物种 动物,中生动物是一种多肉海洋无脊椎寄生动物，现今依然不清楚它们是退化了的扁形动物，还是独立发展出的。一般而言，这些细小、难以理解的生物是由包附在一个或多个生殖细胞上的纤毛种皮细胞所组成的。,"中生动物有着复杂的生命周期，会在无性和有性的阶段间交替。在头足类动物的肾内有许多类似虫一般，由固定数量的体细胞组成的生物（线形体）。在线形体的核心内有轴细胞，这些细胞会产生新的线形体。之后，线形体再转变成菱形体，以准备性发展。性发展起始于菱形体的轴细胞中一个称做 infusorigen 的区域内，在此处发展出阿米巴状的精子来。套细胞会转变成卵。精子由轴细胞中出去，并和卵结合而形成滴幼虫，然后幼虫会爬出来。最后，章鱼再次被年轻虫状的动物感染。中生动物一度被认为是原生生物和动物之间演化的一个过渡型态，但现在，它们则被认为是退化了或简化了的动物。它们的纤毛幼虫和吸虫的纤毛幼虫相似，且它们的内部增殖也和在吸虫体内发生的现象相似。中生动物 的　DNA 有较低的GC含量（40%）。此一数值和纤毛虫相似，但纤毛虫通常有双细胞核。其他和中生动物相关的还包括环节动物、纽形动物和真涡虫等类群。中生动物有两个主要的类群：菱形动物门和直泳动物门，有时也包括扁盘动物门和单胚动物门。单胚动物门只包含一个只在十九世纪时有过一次描述的物种，且自此便不曾再见过。因此，许多人怀疑它们是一个真实的类群。[2] 根据描述，这种动物只有单一层的组织。 "
orthonectida,直泳动物门,https://timgsa.baidu.com/timg?image&quality=80&size=b9999_10000&sec=1492626463610&di=af352abe254d1c2fb8f6eb6ccf71c957&imgtype=0&src=http%3A%2F%2Fphoto.hanyu.iciba.com%2Fupload%2Fchinesewiki%2F4%2FZ%2F4ZUa.jpg,自然 生物物种 动物,直泳动物门是由所知甚少的海底无脊椎动物寄生虫所组成的一个小门，是最简单的多细胞生物之一。,直泳动物门是由所知甚少的海底无脊椎动物寄生虫所组成的一个小门，是最简单的多细胞生物之一。寄生的生物有扁形动物、多毛纲的虫、双壳纲的软体动物和棘皮动物等。已知的物种大约有20种，其中以 Rhopalura ophiocomae 最为知名。
rhombozoa,菱形动物门,https://timgsa.baidu.com/timg?image&quality=80&size=b9999_10000&sec=1492704446747&di=56e821a355e6a546a8cac9c6d4149253&imgtype=0&src=http%3A%2F%2Fimgsrc.baidu.com%2Fforum%2Fw%253D580%2Fsign%3Da560dc1a0d2442a7ae0efdade142ad95%2F66a7912bd40735faddfca8209c510fb30e24085e.jpg,自然 生物物种 动物,菱形动物门（学名Rhombozoa），或二胚虫目（Dicyemida）是栖息在头足类肾附属物的一门寄生虫。二胚动物门其实是在菱形动物门之前命名的，但现今一般都会以菱形动物门来称呼这类动物。,"菱形虫门长约0.1—9.0毫米，在显微镜下可以清晰看见。它们的细胞数目恒定，约有由20-30个细胞组成，故很轻易分辨。外层是单层的具有纤毛的体细胞，包围着中央的轴细胞。前端有一个极帽，可以将它们连接在寄主的肾附属物表层上。菱形动物门同时有无性繁殖及有性繁殖的形态。[4]前者多在幼生及未成熟的寄主上出现，后者则会出现在成熟的寄主。无性繁殖的阶段称为线形体，它们会生产蠕虫状的幼虫，幼虫为熟会产生更多的线形体。[5]线形体可以在幼生头足类激增充满其肾。随着时间过去，当线形体的数量到达某程度时，蠕虫状幼虫会成熟及变成菱形体，进入有性繁殖阶段。菱形体包含了雌雄同体的滴虫形幼虫原体，可以生成滴虫形幼虫。[5]这些幼虫的形态很特别，以像车前灯的纤毛节来游泳。科学家一直假设这种滴虫形幼虫会随寄主排尿时一同被排出，且是一种扩散及感染的阶段。不过感染的方式及影响却依然是一个谜。菱形动物门在一些时期是会留在温带的底栖环境，其数量最为丰富。虽然有时在热带也会发现菱形虫门，但一般感染率都很低。菱形动物门从未在真正的海洋性头足类身上发现，因为它们是被纤毛亚门所寄生。大部分菱形动物门的物种都只在一或两个寄主物种中发现。它们虽然并非独特寄生的，却似乎却只寄生在某些相关的寄主身上。"
gastrotricha,腹毛动物门,https://timgsa.baidu.com/timg?image&quality=80&size=b9999_10000&sec=1492626530844&di=e5992941255bfe5a6cc57f895ff3463b&imgtype=0&src=http%3A%2F%2Fg.hiphotos.baidu.com%2Fbaike%2Fs%253D220%2Fsign%3D928a03057bcb0a4681228c3b5b62f63e%2Fb3b7d0a20cf431ad5596a2c64b36acaf2fdd988d.jpg,自然 生物物种 动物,腹毛动物门是动物界的一个门。是生活在海洋或淡水中的、身体腹面披有纤毛一类小型动物。大约有400种，一般认为是假体腔动物中最原始的一类。,"腹毛动物门是动物界的一个门。是生活在海洋或淡水中的、身体腹面披有纤毛一类小型动物。大约有400种，一般认为是假体腔动物中最原始的一类。腹毛动物超门分为2个亚门：大鼬目（Macrodasyida）：例如侧鼬虫（Pleurodasys）、大鼬虫（Macrodasys）、指足鼬虫（Dactylopodala）等。鼬虫目（Chaetonotida）：例如鼬虫、鳞皮鼬虫（Lepidodermella）等。"
bryozoa,苔藓动物门,https://timgsa.baidu.com/timg?image&quality=80&size=b9999_10000&sec=1492707189003&di=717df0c291d90efd1cccee37be514cf3&imgtype=0&src=http%3A%2F%2Fwww.zjhaigao.net%2Fbio%2Fswtd%2Fdongwu%2Ftaixianchongdongwumen%2Fimages%2F1-a2.jpg,自然 生物物种 动物,苔藓动物门（Bryozoa）动物界的一门，为真体腔动物。因肛门开口于触手冠之外，故有外肛动物门之称。已描述约2万种，其中现生种约占1/5。,苔藓动物门为群体，营固着生活，外形似苔藓植物，故名。大多数生活在温带海域，少数淡水产。群体的每个个体很小，不及l毫米。外被一由外胚层分泌的角质或钙质的虫室；个体头部不明显，前端体壁外突，于口周围形成圆形或马蹄形物，其上生有触手，触手具纤毛，这是触手冠，称为总担，为摄食器官。肛门开口于总担的外侧，故名外肛动物Ectoprocta。雌雄同体，通常以出芽生殖。现存种类约4000种，化石种有15000种。可分为2纲：被唇纲和裸唇纲。海产苔藓虫在船底及一些设施上形成特定的生物群落，造成不同程度的危害，阻碍养殖生物的生长发育，使产量下降。苔藓动物绝大多数都生活在海洋中 。多栖息在大陆架浅海。一般都固着在坚硬的附着基上，少数种类借附着机构定着于泥沙中。摄食水中的悬浮物。苔藓动物摄食水中的悬浮物。当触手冠伸出体外时，触手即伸展成触手钟，含有食物颗粒的水从触手冠上部进入触手钟内，然后聚集在口的上部，进入富有弹性的咽内，借咽的突然膨胀，吸入胃内。
cycliophora,环口动物门,http://h.hiphotos.baidu.com/baike/w%3D268%3Bg%3D0/sign=065047365dee3d6d22c680cd7b2d0a1f/d0c8a786c9177f3e3064a89c74cf3bc79e3d56ca.jpg,自然 生物物种 动物,环口动物门（微轮动物门），一类水生动物，身体长度小于0.5毫米，寄生于龙虾体内。,它们身体呈囊状，在生命周期的不同阶段具有不同的形态。环口动物发现于1995年，由于该类动物的特殊性，被列为单独的一个门。环口动物与轮形动物可能是近亲。
entoprocta,内肛动物门,https://timgsa.baidu.com/timg?image&quality=80&size=b9999_10000&sec=1492706943643&di=db4955628efb4b0fd49a3e8e06dd0286&imgtype=0&src=http%3A%2F%2Fimg.mp.itc.cn%2Fupload%2F20161020%2F1abaa69035034ccc9999d34517e99ebb_th.jpeg,自然 生物物种 动物,内肛动物门（学名：Entoprocta）是动物界的一个门。分类上曾一度把它们与外肛动物门合称为苔藓动物门（Bryozoa）。后来发现内肛动物为假体腔动物，而外肛动物为真体腔动物，现行分类已将这两类动物独立成门。,内肛动物大约有150多种，绝大多数体型不超过5mm。 内肛动物门，水生无脊椎动物，分布于全世界，主要见于海洋生境。有少数生活于淡水。内肛动物为单体或通过出芽方式形成相互交通的群体；其中，每个个体称为个员，高仅0.4～0.5毫米，有一条柄，可以互相结合，柄可附着在贝壳、海草或其他会产生水流的动物，如海绵、苔藓动物、水螅和环节动物上。身上有一个球状的头部（萼），其中包容一个U形的消化道以及神经、排泄和生殖系统。具纤毛的触手排成冠状，用以产生水流，将食物颗粒送入位于中央的口部。营群体生活的各类常将萼总抛弃，然后再生。营单体生活的种类可以生出子芽，子芽成熟后脱离母体。虽然内肛动物的幼体及其早期发育方式表明内肛动物可能与环节动物和与环节动物近缘的门有遥远的亲缘关系，但无证据表明内肛动物与任何门的动物为近缘。
rotifera,轮虫动物门,https://timgsa.baidu.com/timg?image&quality=80&size=b9999_10000&sec=1492706841914&di=6bba4c008a7d11b04f56624924230b5f&imgtype=0&src=http%3A%2F%2Fa0.att.hudong.com%2F87%2F62%2F01300000931071128140623343324.jpg,自然 生物物种 动物,轮形动物门（学名：Rotifera），又称轮虫动物门，是动物界的一个门。是主要生活在淡水中的小型动物，约有1800种左右。轮形动物在假体腔动物中是相当繁盛的一类。,身体短圆，有明亮的壳，两侧对称，身体的后端多数有尾状部；前端有一纤毛盘，具有运动功能；纤毛摆动时状如旋转的轮盘，所以得名；咽内具有咀嚼器，无真体腔。
acanthocephala,棘头动物门,https://timgsa.baidu.com/timg?image&quality=80&size=b9999_10000&sec=1492705683995&di=2ba0995797a04f1502c067060d368bb4&imgtype=0&src=http%3A%2F%2Fa2.att.hudong.com%2F05%2F54%2F01300538077160139058547664416_s.jpg,自然 生物物种 动物,棘头动物门是动物界的一个门。是一类身体前端有吻，吻上有钩刺的假体腔动物。,棘头动物属于寄生动物，吻上的钩刺用来抓住它的寄主的肠壁。它们具有复杂的生命周期，涉及到若干寄主，包括无脊椎动物、鱼类、两栖类、鸟类和哺乳类。大约只有700种。
micrognathozoa,微颚动物门,https://timgsa.baidu.com/timg?image&quality=80&size=b9999_10000&sec=1492705743398&di=b5ac03d496f2444561699f13cf368700&imgtype=0&src=http%3A%2F%2Fimgsrc.baidu.com%2Fbaike%2Fpic%2Fitem%2Fe824b899a9014c08d0a77d3e0a7b02087af4f489.jpg,自然 生物物种 动物,微颚动物门(Micrognathozoa)是1994年发现的一个门。目前只有一种动物Limnognathia maerski，由丹麦科学家在格陵兰北部的迪斯科岛地区的泉水里首次发现。,它被归入扁形动物超门。其身体小于1mm。颚的构造复杂，作为觅食工具通过过滤水流而获得食物。单性生殖。生活在严寒环境。
gnathostomulida,颚胃动物门,https://timgsa.baidu.com/timg?image&quality=80&size=b9999_10000&sec=1492626877319&di=5b563d58dad80e1704393dffd406c26c&imgtype=0&src=http%3A%2F%2Fb.hiphotos.baidu.com%2Fbaike%2Fpic%2Fitem%2F29381f30e924b899f89087c76e061d950b7bf6a5.jpg,自然 生物物种 动物,颚胃动物门（学名Gnathostomulida）是动物界的一个门。这类无体腔的动物体型很小，生活在浅海细砂间，于1956年发现。目前已记录了18个属，大约有100种。,颚胃动物门（学名Gnathostomulida）是动物界的一个门。这类无体腔的动物体型很小，生活在浅海细砂间，于1956年发现。目前已记录了18个属，大约有100种。
procoelomata,原腔动物门,https://timgsa.baidu.com/timg?image&quality=80&size=b9999_10000&sec=1492627011261&di=d0a7fdcb8f1b893e2f4cad19a37cfa84&imgtype=jpg&src=http%3A%2F%2Fimg4.imgtn.bdimg.com%2Fit%2Fu%3D1081391055%2C2980992606%26fm%3D214%26gp%3D0.jpg,自然 生物物种 动物,原腔动物门(Protocoelomata)：原腔动物又称假体腔动物或线形动物，是一类宠大而复杂的动物类群，种类达18000多种，形态差别很大，并且他们的发展历史不详，亲缘关系不明，但他们都有假体腔。,"1，具有原体腔（假体腔pseudocoelomate，初生体腔）1）概念：它是指体辟内侧中胚层和肠壁外侧内胚层之间的空腔，是囊胚腔的剩余部分.2）特点：①只有体壁中胚层，无肠壁中胚层②假体腔直接与肌肉为界，无中胚层形成的体腔膜和肠系膜③是一封闭的腔，充满体腔液.3）生物学意义：①体腔的出现，促进肠道与体壁独立运动②使内腔器官具有稳定内环境.原体腔的含义，特点，生物学意义是这章的重点！！2，体形圆柱形，体不分节，无明显头部，外覆角质膜.3，具完全消化系统：口→食道→中肠→直肠→肛门4，还未有专门的循环系统和呼吸系统：体腔液的流动起循环作用；体表呼吸，寄生种类厌氧呼吸.5，原肾管型的排泄系统：管型或腺型线虫的排泄器官属于原肾型，而结构不典型，是由腺型细胞或由细胞形成的管完成排泄功能.原始的种类只有1—2个大型的腺细胞进行排泄及水分调节，也称肾细胞（renette cell).另一些种，腺型肾细胞延伸成管型排泄器，多呈H型管.6，筒状神经系统：神经系统简单，由神经环，纵神经干，神经节构成，呈筒状."
nemertea,纽形动物门,https://timgsa.baidu.com/timg?image&quality=80&size=b9999_10000&sec=1492705802202&di=20e170219708c340ccdb3430e0966c61&imgtype=0&src=http%3A%2F%2Fi3.qhimg.com%2Ft01e06e0c697c96c909.jpg,自然 生物物种 动物,纽形动物门是动物界的一个门。是一类具吻的长带形动物，绝大多数为海洋底栖生活。,与扁形动物一样，纽形动物也是两侧对称、三胚层、无体腔的动物，但具有完整的消化道（即有口和肛门）、无心脏的循环系统、一个捕食及防卫的可伸缩的长吻，多数种类为雌雄异体，说明纽形动物较扁形动物更为进化，因此现行分类系统中都将纽形动物独立成一个门。
hyolitha,软舌螺动物门,https://timgsa.baidu.com/timg?image&quality=80&size=b9999_10000&sec=1492705830307&di=0bb3e02b8e2ddea1363730bf4283d046&imgtype=0&src=http%3A%2F%2Fimages.hdzc.net%2Fuploadfile%2F2017%2F0116%2F20170116030212774.png,自然 生物物种 动物,软舌螺动物（学名：Hyolitha）是一种从古生代开始出现的神秘动物，具有小圆锥形的螺壳。,"这些物种目前都已全部灭绝；其化石一般只能保存锥壳、口盖和附肢三个部分，外壳为钙质成分，两侧对称。根据形态学的分类，本物种是一类海生有壳的无脊椎动物，但再具体一点的分类众说纷纭：一种意见认为它是软体动物门之下的一个纲，另一种意见则认为它与软件动无本质上的联系，应属一个独立的门。近期以软组织化石分析发现软舌螺动物具有触手冠 (Lophophore) 这种进食器官，指出软舌螺动物其实应该独立为一门，而且和包含腕足动物门在内的触手冠动物 (Lophophorata) 较相近。软舌螺动物的碳酸钙质外壳很大可能是由霰石组成[6]。 有口盖保护，还有两条又名海伦体的弯弯附肢（helens）去支撑身体，以边缘增生的形式成长[6]。 体长一般在一公分到四公分，横切面呈三角形或椭圆形。部分物种有环纹或条纹。"
annelida,环节动物门,https://timgsa.baidu.com/timg?image&quality=80&size=b9999_10000&sec=1492708187144&di=728200d2bf7a1013d78b1c19e61ceeee&imgtype=0&src=http%3A%2F%2Fwww.pep.com.cn%2Fczsw%2Fjshzhx%2Fjxzt%2Fbnjsc%2Fxxdwhhjdw%2Fjxfz%2Fjcct%2F201409%2FW020140928372866942963.jpg,自然 生物物种 动物,环节动物门是动物界的1个门，该门动物为两侧对称、分节的裂生体腔动物，有的具疣足和刚毛，多闭管式循环系统、链式神经系统。目前已知的环节动物约有13000种。,"环节动物的消化道由口，咽，食道，腺囊，肌肉胃，中肠和肛门组成。循环系统由心脏，腹背两套血管和滋养器官的小型侧边血管组成。身体细长蚯蚓每一个体节里有两个后肾管，它们负责收集前一体节的体液。体液通过肾孔流到下一体节，途中经过盘曲的肾管，直到膀胱。然后通过肾孔排出体外。终尿里面是含氮的物质。而无机盐则会被肾管上皮重吸收回到血液。为了平衡通过皮肤吸收的水分，蚯蚓的尿液会稀释得很厉害。蚯蚓每天可排出约体重的60%稀薄尿液。后肾管被腹膜“绑”着固定于体腔壁上。环节动物的繁殖能力非常强：体节的分离和出芽生殖的无性生殖。但有性生殖也很重要。多毛纲的动物大多是雌雄异体。而原环虫纲则是雌雄同体。"
pogonophora,须腕动物门,https://timgsa.baidu.com/timg?image&quality=80&size=b9999_10000&sec=1492705862714&di=0169474b1a282154cce50b84fd946b5f&imgtype=0&src=http%3A%2F%2Fgenshuo.net.cn%2Fbook_cover%2Fbd11319047.jpg,自然 生物物种 动物,须腕动物门（Pogonophora）是动物界的1门，该门动物是一类海生、非常长的蠕虫形的后生动物，最长可达36cm；是唯一没有口和消化管的非寄生三胚层无脊椎动物。,"细长触手是须腕动物门的主要鉴别特征，须腕动物与其他动物类群的触手不同之处在于它们具有微小的羽枝，这些羽枝系由单一的表皮细胞延长而成，具有吸收营养物质的功能。须腕动物栖居在几丁质-硬蛋白构成的栖管内。管垂直插于海底淤泥或其他沉淀物里，部分管露出泥外。栖管外表细如玉米须或较粗；大多数属的栖管具褐色或黄色的色带。动物身体细而长，其多数种类的宽度（直径）不到1毫米，但体长却为体宽的100倍以上。须腕动物的真体腔和许多成虫的形态特征，表明它们与半索动物有亲缘关系。四部分①触手区，系动物体的前部（前体），具细长的触手，触手由圆形或三角形的位于触手区背面的头叶基部腹面伸出，从单一的螺旋形触手到多达200根以上排列成螺旋形圆柱体的触手。②系带区（中体），又称腺体区，位于触手区和生殖区（后体）之间，较短，其主要功能是分泌几丁质-硬蛋白构成栖管，在腹面有几丁质系带，当虫体以栖管前端伸出时，系带可依附在管壁上以支持虫体的活动。③生殖区，又称躯干部，极长，位于系带区之后，具许多外乳突和其他几丁质附着构造。④尾体，系动物体后末端的分节区。尾体系由5～23个体节构成，内部具隔膜，外部具刚毛，与环节动物的体节相似。尾体及其刚毛的功能可能是使动物锚定在栖管内，并有助于动物在海底淤泥中凿穴活动。尾体结构脆弱，当动物被外力拉于海底淤泥时，易与动物体断开而留在海底。须腕动物系雌雄异体；生殖孔的位置是其唯一的性别特征。生殖腺成双，圆柱形，位于生殖区的侧面。雄生殖孔开口于生殖区靠近系带区腹面的生殖突上，雌生殖孔开口于生殖区的中部。雄生殖管的末端部分把精子收集在精荚内；精荚具长尾。须腕动物的精子运输过程至今尚未观察到，但已知西伯加虫属的精荚是以触手运送至栖管管口的。受精过程尚未观察到，但在雌虫栖管内发现了发育的幼虫。卵子在雌虫栖管内孵育。卵子两侧对称；卵圆形或椭圆形，富含卵黄。卵裂方式是由辐射型或螺旋型发展而来的两侧对称型。无囊胚腔，以外包法形成原肠腔。从栖管收集到的后期胚胎具许多卵黄和两个纤毛环带。幼虫活动能力小，在附着以前一直呆在母虫栖管内。至于幼虫离开母虫栖管后，究竟借水流漂浮或是立即下沉到海底，尚不清楚。大多数须腕动物都栖息于海底淤泥中，生活在直立的栖管内。它们通常密集成群；有时数量多达每平方米200条。极少数种在烂木或其他碎屑间构筑栖管。栖管很长，一般长达10～85厘米，有的甚至超过2米。在栖管管壁上，常有腔肠动物、海绵和苔藓虫等附着。须腕动物几乎全为深水生物，其栖息深度均在100米以下，个别种能分布于深达9735米的海沟底，在高纬度地区常栖息于较浅的水域，而在低纬度地区则生活于深海海沟内。大多数须腕动物都分布于大陆坡以及大的岛屿周围，这和它们的营养方式密切有关。须腕动物可以从栖息地周围的淤泥中吸收溶解的有机质，因此须腕动物分布最多的海区，经常有大量的有机质；而这些有机质与海流的流向、流速和底质有着密切的关系。"
vestimentifera,前庭动物门,https://timgsa.baidu.com/timg?image&quality=80&size=b9999_10000&sec=1492706799641&di=059d1ea0048712d09874410e72384af9&imgtype=0&src=http%3A%2F%2Fp2.qhimg.com%2Fdmsmty%2F350_200_%2Ft01ecb6fb7bb3a4a22c.jpg,自然 生物物种 动物,暂无简介,暂无简介
echiura,螠虫动物门,https://timgsa.baidu.com/timg?image&quality=80&size=b9999_10000&sec=1492705904104&di=ac3330a8afef1eae0dc13882fe9450ea&imgtype=0&src=http%3A%2F%2Fd.hiphotos.baidu.com%2Fbaike%2Fw%253D200%2Fsign%3D35898ebdb9014a90813e41bd99763971%2F63d0f703918fa0ec23645502269759ee3d6ddb19.jpg,自然 生物物种 动物,螠虫动物门（学名Echiura）是动物界的一个小门，是一类生活中海洋中的底栖动物，主要生活在浅海的泥沙中、岩石缝中以及珊瑚礁或贝壳中穴居。目前已知的种类约有150种。,"螠类体长在15mm—500mm之间，多数不超过10cm，呈柱形或长囊形，身体由吻及躯干部组成，如螠（Echiurus）,吻是身体前端的扁平形突出物，实际是其头叶，与环节动物的口前叶同源。吻不能缩回躯干内，其边缘向腹面卷曲，中央形成一口道（gutter），表面具纤毛。吻的基部边缘愈合，围绕口形成一漏斗形。吻的端部呈铲状，但有的种吻端部呈双叉型，如叉螠（Bonellia）。吻的长度变化很大，一般短于躯干的1/2，但有的种吻极长，如叉螠躯干长8cm，而其吻可长达1m，一种日本螠（Ikeda）体长40cm，而其吻长1.5m，吻用以取食。身体一般呈淡灰色或褐色，某些种呈绿色、玫瑰色、或呈透明状。躯干部呈圆柱形，表面光滑，或散布有大量的乳突，或乳突成环状排列。乳突分泌的粘液可形成穴道。躯干部前端腹面具有二枚大的弯曲的刚毛，有的种尾端也有1—2圈小刚毛，这些刚毛也来自刚毛囊，并有肌肉控制其运动，用这些刚毛固着身体及清洁穴道。螠虫的体壁结构相似于环节动物，体表有薄的角质层（吻沟中没有），上皮细胞基部有色素颗粒，肌肉排列成片状或束状，其纵肌纤维发达。体腔发达，位于躯干部形成一宽阔的腔，周围有体腔膜，吻部有一些管或腔隙，与躯干部的体腔有隔板相分，但体腔液是相通的。从发生上看，吻部的腔隙来自胚胎期的囊胚腔，而躯干部的体腔来自中胚层形成的真体腔。体腔液中含有球形的体腔细胞，细胞中含有血红蛋白或色素颗粒。"
sipuncula,星虫动物门,https://timgsa.baidu.com/timg?image&quality=80&size=b9999_10000&sec=1492705935821&di=f601a196b9b177069cd88e5ec8e3ea01&imgtype=0&src=http%3A%2F%2Fwww.sznews.com%2Ftech%2Fimages%2Fattachement%2Fjpg%2Fsite3%2F20120329%2F001558d90b3310de043100.jpg,自然 生物物种 动物,星虫动物（学名：Sipuncula或Sipunculida）是海洋底栖的对称无环节动物，分布与生活环境及生活方式与螠类相似。,星虫动物（学名：Sipuncula或Sipunculida）是海洋底栖的对称无环节动物，分布与生活环境及生活方式与螠类相似。根据不同的分类或估计方式，现时本门物种从144到300种不等。比较知名的物种有：土钉虫和方格星虫。 星虫动物的学名Sipuncula的意思就是“小型的虹管”。 动物界的一个门，现时基于分子生物学的研究，可能会放到环节动物门之下成为一个“亚门”。
